{
  "schemaVersion": "1.0",
  "transactionId": "HLAS-0072:v1.0:21d783604757759be7fc4fca738e930dddff11e3",
  "taskId": "HLAS-0072",
  "revisionMapping": {
    "appendOnly": true,
    "previousRevision": null,
    "newRevision": "v1.0",
    "changeReason": "Initial Official Record and source-evidence traceability baseline"
  },
  "changelog": {
    "taskId": "HLAS-0072",
    "revision": "v1.0",
    "date": "2026-08-09",
    "changeSummary": "Stored the HLAS-0072 Official Final Record and linked source evidence",
    "changedLayer": "DOCUMENTATION_EVIDENCE",
    "changedFiles": [
      "Docs/Operations/HLAS-0072 GitHub Source Implementation Record Final Record.md"
    ],
    "commitId": "21d783604757759be7fc4fca738e930dddff11e3",
    "risk": "NON_BLOCKING_SOURCE_GOVERNANCE_FOLLOW_UP",
    "verificationStatus": "PASS"
  },
  "commitMetadata": {
    "repository": "dasom6902-lab/HLAS",
    "branch": "main",
    "commitId": "21d783604757759be7fc4fca738e930dddff11e3",
    "changedFiles": [
      "Docs/Operations/HLAS-0072 GitHub Source Implementation Record Final Record.md"
    ],
    "hash": "fc89bb9fcfb9e5b5e5417ae6d82249a96ef913272894dc0a6121fffff0ebd09f",
    "verificationStatus": "PASS"
  },
  "record": {
    "exists": true,
    "path": "Docs/Operations/HLAS-0072 GitHub Source Implementation Record Final Record.md",
    "hash": "fc89bb9fcfb9e5b5e5417ae6d82249a96ef913272894dc0a6121fffff0ebd09f"
  },
  "verification": {
    "recordExists": true,
    "commitExists": true,
    "hashMatch": true,
    "status": "PASS"
  }
}
